{
  "schema_version": "reagent.external-resource-binding/v0.1",
  "resource_binding_id": "resource-77777777777777777777777777777777",
  "project_id": "project-11111111111111111111111111111111",
  "provider": "GITHUB",
  "resource_type": "git-repository",
  "locator": "https://github.com/example/reagent-fixture.git",
  "immutable_revision": "0123456789abcdef0123456789abcdef01234567",
  "expected_checksum": "sha256:cccccccccccccccccccccccccccccccccccccccccccccccccccccccccccccccc",
  "workspace_relative_path": "resources/resource-77777777777777777777777777777777",
  "access_mode": "READ_ONLY",
  "sync_policy": "PULL_ON_EXPLICIT_SYNC",
  "availability": "UNRESOLVED",
  "allow_patterns": ["docs/**"],
  "ignore_patterns": ["private/**"],
  "license_access_warning": "Verify the fictional repository license before use."
}
